# advanced_sql_expansion.slt — RED coverage for the remaining SQL expression and relational features

statement ok
CREATE TABLE adv_people (id INT, score INT, category CHAR(10));

statement ok
INSERT INTO adv_people VALUES (1, 10, 'low');

statement ok
INSERT INTO adv_people VALUES (2, 20, 'mid');

statement ok
INSERT INTO adv_people VALUES (3, 20, 'mid');

statement ok
INSERT INTO adv_people VALUES (4, 30, 'high');

statement ok
CREATE TABLE adv_other (score INT);

statement ok
INSERT INTO adv_other VALUES (15);

statement ok
INSERT INTO adv_other VALUES (25);

statement ok
CREATE TABLE adv_left (id INT, label CHAR(10));

statement ok
INSERT INTO adv_left VALUES (1, 'L1');

statement ok
INSERT INTO adv_left VALUES (2, 'L2');

statement ok
CREATE TABLE adv_right (id INT, label CHAR(10));

statement ok
INSERT INTO adv_right VALUES (2, 'R2');

statement ok
INSERT INTO adv_right VALUES (3, 'R3');

statement ok
CREATE TABLE adv_nleft (id INT, lvalue CHAR(10));

statement ok
INSERT INTO adv_nleft VALUES (1, 'N1');

statement ok
INSERT INTO adv_nleft VALUES (2, 'N2');

statement ok
CREATE TABLE adv_nright (id INT, rvalue CHAR(10));

statement ok
INSERT INTO adv_nright VALUES (2, 'M2');

statement ok
INSERT INTO adv_nright VALUES (3, 'M3');

statement ok
CREATE TABLE adv_a (id INT);

statement ok
INSERT INTO adv_a VALUES (1);

statement ok
INSERT INTO adv_a VALUES (2);

statement ok
INSERT INTO adv_a VALUES (2);

statement ok
INSERT INTO adv_a VALUES (3);

statement ok
CREATE TABLE adv_b (id INT);

statement ok
INSERT INTO adv_b VALUES (2);

statement ok
INSERT INTO adv_b VALUES (2);

statement ok
INSERT INTO adv_b VALUES (4);

statement ok
CREATE TABLE adv_target (id INT, score INT);

query
SELECT id, CASE WHEN score >= 20 THEN 'pass' ELSE 'fail' END AS status FROM adv_people ORDER BY id;
----
+------------------+------------------+
|               id |           status |
+------------------+------------------+
|                1 |             fail |
|                2 |             pass |
|                3 |             pass |
|                4 |             pass |
+------------------+------------------+
Total record(s): 4

query
SELECT COUNT(*) AS missing_case FROM adv_people WHERE CASE WHEN score >= 20 THEN 1 END IS NULL;
----
+------------------+
|     missing_case |
+------------------+
|                1 |
+------------------+
Total record(s): 1

query
SELECT l.id AS left_id FROM adv_left AS l LEFT JOIN adv_right AS r ON l.id = r.id WHERE r.id IS NULL;
----
+------------------+
|          left_id |
+------------------+
|                1 |
+------------------+
Total record(s): 1

query
SELECT r.id AS right_id FROM adv_left l LEFT JOIN adv_right r ON l.id = r.id WHERE r.id IS NOT NULL;
----
+------------------+
|         right_id |
+------------------+
|                2 |
+------------------+
Total record(s): 1

query
SELECT l.id FROM adv_left AS l WHERE EXISTS (SELECT r.id FROM adv_right AS r WHERE r.id = l.id) ORDER BY l.id;
----
+------------------+
|               id |
+------------------+
|                2 |
+------------------+
Total record(s): 1

query
SELECT l.id FROM adv_left AS l WHERE NOT EXISTS (SELECT r.id FROM adv_right AS r WHERE r.id = l.id) ORDER BY l.id;
----
+------------------+
|               id |
+------------------+
|                1 |
+------------------+
Total record(s): 1

query
SELECT id FROM adv_people WHERE score > ANY (SELECT score FROM adv_other) ORDER BY id;
----
+------------------+
|               id |
+------------------+
|                2 |
|                3 |
|                4 |
+------------------+
Total record(s): 3

query
SELECT id FROM adv_people WHERE score >= ALL (SELECT score FROM adv_other) ORDER BY id;
----
+------------------+
|               id |
+------------------+
|                4 |
+------------------+
Total record(s): 1

query
SELECT id FROM adv_a INTERSECT SELECT id FROM adv_b;
----
+------------------+
|               id |
+------------------+
|                2 |
+------------------+
Total record(s): 1

query
SELECT id FROM adv_a EXCEPT SELECT id FROM adv_b;
----
+------------------+
|               id |
+------------------+
|                1 |
|                3 |
+------------------+
Total record(s): 2

query
SELECT l.id AS left_id, r.id AS right_id FROM adv_left AS l CROSS JOIN adv_right AS r ORDER BY l.id, r.id;
----
+------------------+------------------+
|          left_id |         right_id |
+------------------+------------------+
|                1 |                2 |
|                1 |                3 |
|                2 |                2 |
|                2 |                3 |
+------------------+------------------+
Total record(s): 4

query
SELECT l.id FROM adv_nleft AS l NATURAL JOIN adv_nright AS r;
----
+------------------+
|               id |
+------------------+
|                2 |
+------------------+
Total record(s): 1

query
SELECT l.id AS left_id, r.id AS right_id FROM adv_left AS l LEFT JOIN adv_right AS r ON l.id = r.id ORDER BY r.id NULLS FIRST, l.id DESC NULLS LAST;
----
+------------------+------------------+
|          left_id |         right_id |
+------------------+------------------+
|                1 |             NULL |
|                2 |                2 |
+------------------+------------------+
Total record(s): 2

query
SELECT p.id AS person_id, p.score points FROM adv_people AS p ORDER BY points DESC, person_id ASC;
----
+------------------+------------------+
|        person_id |           points |
+------------------+------------------+
|                4 |               30 |
|                2 |               20 |
|                3 |               20 |
|                1 |               10 |
+------------------+------------------+
Total record(s): 4

query
SELECT COUNT(DISTINCT score) AS distinct_scores FROM adv_people;
----
+------------------+
|  distinct_scores |
+------------------+
|                3 |
+------------------+
Total record(s): 1

statement ok
INSERT INTO adv_target (id, score) SELECT id, score FROM adv_people WHERE score > 10;

query
SELECT id, score FROM adv_target ORDER BY id;
----
+------------------+------------------+
|               id |            score |
+------------------+------------------+
|                2 |               20 |
|                3 |               20 |
|                4 |               30 |
+------------------+------------------+
Total record(s): 3

statement ok
UPDATE adv_people SET score = score + 1 WHERE (id = 1 OR id = 2) AND score IS NOT NULL;

query
SELECT id, score FROM adv_people ORDER BY id;
----
+------------------+------------------+
|               id |            score |
+------------------+------------------+
|                1 |               11 |
|                2 |               21 |
|                3 |               20 |
|                4 |               30 |
+------------------+------------------+
Total record(s): 4

query
SELECT id, CASE WHEN score = 11 THEN NULL ELSE score END AS maybe_null FROM adv_people ORDER BY id;
----
+------------------+------------------+
|               id |       maybe_null |
+------------------+------------------+
|                1 |             NULL |
|                2 |               21 |
|                3 |               20 |
|                4 |               30 |
+------------------+------------------+
Total record(s): 4

query
SELECT COUNT(*) AS exists_count FROM adv_people WHERE EXISTS (SELECT score FROM adv_other WHERE score = 15);
----
+------------------+
|     exists_count |
+------------------+
|                4 |
+------------------+
Total record(s): 1

query
SELECT COUNT(*) AS no_exists_count FROM adv_people WHERE NOT EXISTS (SELECT score FROM adv_other WHERE score = 99);
----
+------------------+
|  no_exists_count |
+------------------+
|                4 |
+------------------+
Total record(s): 1

statement ok
CREATE TABLE adv_empty (score INT);

query
SELECT COUNT(*) AS any_empty FROM adv_people WHERE score = ANY (SELECT score FROM adv_empty);
----
+------------------+
|        any_empty |
+------------------+
|                0 |
+------------------+
Total record(s): 1

query
SELECT COUNT(*) AS all_empty FROM adv_people WHERE score >= ALL (SELECT score FROM adv_empty);
----
+------------------+
|        all_empty |
+------------------+
|                4 |
+------------------+
Total record(s): 1

query
SELECT COUNT(DISTINCT r.id) AS matched_ids FROM adv_left AS l LEFT JOIN adv_right AS r ON l.id = r.id;
----
+------------------+
|      matched_ids |
+------------------+
|                1 |
+------------------+
Total record(s): 1

query
SELECT * FROM adv_nleft NATURAL JOIN adv_nright;
----
+------------------+------------------+------------------+
|               id |           lvalue |           rvalue |
+------------------+------------------+------------------+
|                2 |               N2 |               M2 |
+------------------+------------------+------------------+
Total record(s): 1

query
SELECT id FROM adv_nleft NATURAL JOIN adv_nright;
----
+------------------+
|               id |
+------------------+
|                2 |
+------------------+
Total record(s): 1

statement ok
CREATE TABLE adv_reordered_target (id INT, score INT);

statement ok
INSERT INTO adv_reordered_target (score, id) SELECT score, id FROM adv_people WHERE id <= 2;

query
SELECT id, score FROM adv_reordered_target ORDER BY id;
----
+------------------+------------------+
|               id |            score |
+------------------+------------------+
|                1 |               11 |
|                2 |               21 |
+------------------+------------------+
Total record(s): 2
