# transaction.slt - explicit and implicit transaction tests

statement ok
CREATE TABLE accounts (id INT, name CHAR(12), balance FLOAT);

statement ok
INSERT INTO accounts VALUES (1, 'alice', 10.0);

query
SELECT * FROM accounts WHERE id = 1;
----
+------------------+------------------+------------------+
|               id |             name |          balance |
+------------------+------------------+------------------+
|                1 |            alice |        10.000000 |
+------------------+------------------+------------------+
Total record(s): 1

statement ok
BEGIN;

statement ok
INSERT INTO accounts VALUES (2, 'bob', 20.0);

statement ok
UPDATE accounts SET balance = 15.0 WHERE id = 1;

statement ok
DELETE FROM accounts WHERE id = 2;

statement ok
ABORT;

query
SELECT * FROM accounts WHERE id = 1;
----
+------------------+------------------+------------------+
|               id |             name |          balance |
+------------------+------------------+------------------+
|                1 |            alice |        10.000000 |
+------------------+------------------+------------------+
Total record(s): 1

query
SELECT * FROM accounts WHERE id = 2;
----
+------------------+------------------+------------------+
|               id |             name |          balance |
+------------------+------------------+------------------+
+------------------+------------------+------------------+
Total record(s): 0

statement ok
BEGIN;

statement ok
INSERT INTO accounts VALUES (3, 'carol', 30.0);

statement ok
UPDATE accounts SET balance = 11.0 WHERE id = 1;

statement ok
COMMIT;

query
SELECT id, balance FROM accounts WHERE id = 1;
----
+------------------+------------------+
|               id |          balance |
+------------------+------------------+
|                1 |        11.000000 |
+------------------+------------------+
Total record(s): 1

query
SELECT id, name FROM accounts WHERE id = 3;
----
+------------------+------------------+
|               id |             name |
+------------------+------------------+
|                3 |            carol |
+------------------+------------------+
Total record(s): 1

statement ok
CREATE INDEX accounts (id);

statement ok
BEGIN;

statement ok
INSERT INTO accounts VALUES (4, 'dave', 40.0);

statement ok
UPDATE accounts SET id = 5 WHERE id = 3;

statement ok
DELETE FROM accounts WHERE id = 1;

statement ok
ROLLBACK;

query
SELECT id, balance FROM accounts WHERE id = 1;
----
+------------------+------------------+
|               id |          balance |
+------------------+------------------+
|                1 |        11.000000 |
+------------------+------------------+
Total record(s): 1

query
SELECT id, name FROM accounts WHERE id = 3;
----
+------------------+------------------+
|               id |             name |
+------------------+------------------+
|                3 |            carol |
+------------------+------------------+
Total record(s): 1

query
SELECT id, name FROM accounts WHERE id = 4;
----
+------------------+------------------+
|               id |             name |
+------------------+------------------+
+------------------+------------------+
Total record(s): 0

statement ok
INSERT INTO accounts VALUES (4, 'dave', 40.0);

query
SELECT id, name FROM accounts WHERE id = 4;
----
+------------------+------------------+
|               id |             name |
+------------------+------------------+
|                4 |             dave |
+------------------+------------------+
Total record(s): 1
